<?xml version="1.0" encoding="UTF-8"?>
<!-- Sections: 
section="Session Entry"
section="Boathouse"
section="Base"
section="Widget"
section="Admin/Data Edit"
section="Admin/Other"
section="Admin/Configuration"
section="efaCloud"
section="efaRemote"
section="efaCLI"
section="Kanu-EFB-Sync"
section="GUI/Usability"
section="Clubwork"
section="Stability"
section="Statistics"
section="Other"
-->
<efaOnlineUpdate xmlns:xsi="http://www.w3.org/2001/XMLSchema-instance" xsi:noNamespaceSchemaLocation="eou.xsd">
	<Sections>
		<Section name="Boathouse">
			<Translation lang="de">Bootshaus</Translation>
			<Translation lang="en">Boathouse</Translation>
		</Section>
		<Section name="Session Entry">
			<Translation lang="de">Fahrtanlage</Translation>
			<Translation lang="en">Session Entry</Translation>
		</Section>
		<Section name="Statistics">
			<Translation lang="de">Statistiken</Translation>
			<Translation lang="en">Statistics</Translation>
		</Section>
		<Section name="Clubwork">
			<Translation lang="de">Vereinsarbeit</Translation>
			<Translation lang="en">Clubwork</Translation>
		</Section>	
		<Section name="Base">
			<Translation lang="de">efa Base</Translation>
			<Translation lang="en">efa Base</Translation>
		</Section>
		<Section name="Admin/Data Edit">
			<Translation lang="de">Administration/Datenerfassung</Translation>
			<Translation lang="en">Admin/Data Edit</Translation>
		</Section>
		<Section name="Admin/Other">
			<Translation lang="de">Administration/Sonstiges</Translation>
			<Translation lang="en">Admin/Other</Translation>
		</Section>
		<Section name="Widget">
			<Translation lang="de">Widget</Translation>
			<Translation lang="en">Widget</Translation>
		</Section>		
		<Section name="GUI/Usability">
			<Translation lang="de">Oberfläche/Usability</Translation>
			<Translation lang="en">GUI/Usability</Translation>
		</Section>
		<Section name="Kanu-EFB-Sync">
			<Translation lang="de">Kanu-EFB-Sync</Translation>
			<Translation lang="en">Kanu-EFB-Sync</Translation>
		</Section>
		<Section name="efaCLI">
			<Translation lang="de">efaCLI</Translation>
			<Translation lang="en">efaCLI</Translation>
		</Section>
		<Section name="efaRemote">
			<Translation lang="de">efaRemote</Translation>
			<Translation lang="en">efaRemote</Translation>
		</Section>
		<Section name="efaCloud">
			<Translation lang="de">efaCloud</Translation>
			<Translation lang="en">efaCloud</Translation>
		</Section>
		<Section name="Stability">
			<Translation lang="de">Stabilität/Technische Verbesserung</Translation>
			<Translation lang="en">Stability/Technical Improvement</Translation>
		</Section>
		<Section name="Other">
			<Translation lang="de">Sonstiges</Translation>
			<Translation lang="en">Other</Translation>
		</Section>
	</Sections>
	<Version>
        <VersionID>2.5.4_#1</VersionID>
        <ReleaseDate>01.11.2026</ReleaseDate>
        <DownloadUrl>https://github.com/nicmichael/efa/releases/download/2.5.4_1/efa2.5.4_1.zip</DownloadUrl>
        <DownloadSize>TODO</DownloadSize>
     	<MinimumJavaVersion>1.8</MinimumJavaVersion>
		<MinimumEfaCloudVersion>2.3.3</MinimumEfaCloudVersion>
        <ShowNotice lang="de">Wenn efaCloud eingesetzt wird, muss der Server mindestens Version 2.3.3 unterstützen. EfaCloud 2.4.0_12 und höher werden empfohlen.</ShowNotice>
        <ShowNotice lang="en">If you use efaCloud, make sure your server at least supports efaCloud Version 2.3.3. It is recommended to upgrade to EfaCloud 2.4.0_12 or above.</ShowNotice>
        <Changes lang="de">
			<ChangeItem section="Boathouse">Neu: Optische Verbesserung der Bootshauslisten: Abgerundete Ecken, die "---" in den Sektionen sind entfallen, und es werden nur noch Scrollbalken angezeigt, wenn sie benötigt werden.</ChangeItem>
			<ChangeItem section="Widget">Neu: Die Hintergrund/Textfarbe des Newstickers ist konfigurierbar.</ChangeItem>
			<ChangeItem section="GUI/Useability">Neu: Bei der Auswahl von Farben gibt es nun einen Pastell-Farbwähler und einen, der die EFA-Standardfarben anzeigt. Dies vereinfacht die Farbauswahl und die Wiederverwendung von Farben erheblich.</ChangeItem>
			<ChangeItem section="Other">Neu: FlatLaf Bibliothek auf Version 3.7.2 aktualisiert.</ChangeItem>
			<ChangeItem section="Other">Neu: Plugin.xml aktualisiert.</ChangeItem>
			<ChangeItem section="Other">Neu: In der Plugin-Übersicht die "Installieren" Schaltfläche entfernt, da inzwischen veraltet. Efa wird grundsätzlich mit allen Plugins ausgeliefert.</ChangeItem>
		</Changes>
        <Changes lang="en">
        	<ChangeItem section="Boathouse">New: Visual improvement of the boathouse lists: Rounded corners, the "---" in the sections have been removed, and scroll bars are only displayed when needed.</ChangeItem>
        	<ChangeItem section="Widget">New: The background/text color of the news ticker is configurable.</ChangeItem>
        	<ChangeItem section="GUI/Useability">New: When selecting colors, there is now a pastel color picker and one that displays the EFA standard colors. This greatly simplifies color selection and reuse of colors.</ChangeItem>
       		<ChangeItem section="Other">New: FlatLaf library updated to version 3.7.2.</ChangeItem>
       		<ChangeItem section="Other">New: Plugin.xml updated.</ChangeItem>
       		<ChangeItem section="Other">New: In the plugin overview, the "Install" button has been removed as it is now outdated. Efa is delivered with all plugins by default.</ChangeItem>
       </Changes>
	</Version>
	<Version>
        <VersionID>2.5.3_17</VersionID>
        <ReleaseDate>11.10.2026</ReleaseDate>
        <DownloadUrl>https://github.com/nicmichael/efa/releases/download/2.5.3_17/efa2.5.3_17.zip</DownloadUrl>
        <DownloadSize>8037778</DownloadSize>
     	<MinimumJavaVersion>1.8</MinimumJavaVersion>
		<MinimumEfaCloudVersion>2.3.3</MinimumEfaCloudVersion>
        <ShowNotice lang="de">Wenn efaCloud eingesetzt wird, muss der Server mindestens Version 2.3.3 unterstützen. EfaCloud 2.4.0_12 und höher werden empfohlen.</ShowNotice>
        <ShowNotice lang="en">If you use efaCloud, make sure your server at least supports efaCloud Version 2.3.3. It is recommended to upgrade to EfaCloud 2.4.0_12 or above.</ShowNotice>
        <Changes lang="de">
        	<ChangeItem section="Other">Neu: efa 2.5.3 für Produktion freigegeben auf Basis von Beta efa 2.5.3_#16.</ChangeItem>
        	<ChangeItem section="Other">Neu: eou.xml und eou.xsd an neue Vorgaben für das Online-Update angepasst (abwärtskompatibel). GitHub Download Links aktualisiert in eou.xml</ChangeItem>
        </Changes>
        <Changes lang="en">
        	<ChangeItem section="Other">New: efa 2.5.3 released for production based on Beta efa 2.5.3_#16.</ChangeItem>
			<ChangeItem section="Other">New: eou.xml and eou.xsd adapted to new requirements for online update (backwards compatible). GitHub download links updated in eou.xml</ChangeItem>
        </Changes>
	</Version>
	<Version>
        <VersionID>2.5.3_#16</VersionID>
        <ReleaseDate>19.09.2026</ReleaseDate>
        <DownloadUrl>https://github.com/nicmichael/efa/releases/download/2.5.3-beta.16/efa2.5.3_16.zip</DownloadUrl>
        <DownloadSize>TODO</DownloadSize>
     	<MinimumJavaVersion>1.8</MinimumJavaVersion>
		<MinimumEfaCloudVersion>2.3.3</MinimumEfaCloudVersion>
        <ShowNotice lang="de">Wenn efaCloud eingesetzt wird, muss der Server mindestens Version 2.3.3 unterstützen. EfaCloud 2.4.0_12 und höher werden empfohlen.</ShowNotice>
        <ShowNotice lang="en">If you use efaCloud, make sure your server at least supports efaCloud Version 2.3.3. It is recommended to upgrade to EfaCloud 2.4.0_12 or above.</ShowNotice>
        <Changes lang="de">
        	<ChangeItem section="Admin/Other">BugFix: Verarbeitung der .efacred Datei verbessert. Logging für das Handling der .efacred Datei und für Loginvorgänge verbessert.</ChangeItem>
        </Changes>
        <Changes lang="en">
        	<ChangeItem section="Admin/Other">BugFix: Improved processing of the .efacred file. Logging for handling the .efacred file and for login processes improved.</ChangeItem>
        </Changes>
	</Version>
	<Version>
        <VersionID>2.5.3_#15</VersionID>
        <ReleaseDate>13.09.2026</ReleaseDate>
        <DownloadUrl>https://github.com/nicmichael/efa/releases/download/2.5.3-beta.15/efa2.5.3_15.zip</DownloadUrl>
        <DownloadSize>TODO</DownloadSize>
     	<MinimumJavaVersion>1.8</MinimumJavaVersion>
		<MinimumEfaCloudVersion>2.3.3</MinimumEfaCloudVersion>
        <ShowNotice lang="de">Wenn efaCloud eingesetzt wird, muss der Server mindestens Version 2.3.3 unterstützen. EfaCloud 2.4.0_12 und höher werden empfohlen.</ShowNotice>
        <ShowNotice lang="en">If you use efaCloud, make sure your server at least supports efaCloud Version 2.3.3. It is recommended to upgrade to EfaCloud 2.4.0_12 or above.</ShowNotice>
        <Changes lang="de">
        	<ChangeItem section="Admin/Data Edit">Bugfix: Dialoge für die Bearbeitung von Booten, Personen, Gruppen, Zielen wurden größer als das konfigurierte Limit für Dialoggrößen.</ChangeItem>
        	<ChangeItem section="Stability">Neu: die Änderungshistorie zeigt die Änderungen einer Version nun je nach Bereich an. Dazu wurde eou.xml überarbeitet und um alle Einträge früher als Version 2.3.3 bereinigt.</ChangeItem>
        </Changes>
        <Changes lang="en">
			<ChangeItem section="Admin/Data Edit">Bugfix: Dialogs for editing boats, persons, groups, and destinations were larger than the configured limit for dialog sizes.</ChangeItem>
			<ChangeItem section="Stability">New: The change history now displays the changes of a version according to their respective areas. For this purpose, eou.xml has been revised and all entries earlier than version 2.3.3 have been cleaned up.</ChangeItem>
        </Changes>
	</Version>	
	<Version>
        <VersionID>2.5.3_#14</VersionID>
        <ReleaseDate>10.09.2026</ReleaseDate>